UNIT_LINK,MIN_EON,MIN_ERA,MIN_PERIOD,MIN_EPOCH,MIN_AGE,FULL_MIN,CMIN_AGE,MAX_EON,MAX_ERA,MAX_PERIOD,MAX_EPOCH,MAX_AGE,FULL_MAX,CMAX_AGE,MIN_MA,MAX_MA,AGE_TYPE,AGE_COM
WATKg;0,Phanerozoic,Cenozoic,Tertiary,Eocene,,Phanerozoic Cenozoic  Tertiary    Eocene     ,Eocene,Phanerozoic,Mesozoic,Cretaceous,Late-Cretaceous,,Phanerozoic Mesozoic  Cretaceous   Late-Cretaceous    ,Late-Cretaceous,33.9,99.6,Relative,"K-Ar hornblende age of 90 Ma and zircon age of 90 Ma in Black Peak Batholith of Okanogan County (Miller, 1987).  The Jordan Lakes pluton yielded U-Pb ages ranging from 58 to 90 Ma; the Cyclone Lake pluton yielded K-Ar ages of 28 and 57 Ma (Dragovich and others, 2002). Stoffel, 1990, reports K-Ar ages of 51.1 Ma and 53.7 Ma for plutons in Ferry County.  "
WATKv;0,Phanerozoic,Mesozoic,Cretaceous,Late-Cretaceous,Coniacian,Phanerozoic Mesozoic  Cretaceous    Late-Cretaceous     Coniacian,Coniacian,Phanerozoic,Mesozoic,Cretaceous,Late-Cretaceous,,Phanerozoic Mesozoic  Cretaceous   Late-Cretaceous    ,Late-Cretaceous,85.8,99.6,Relative,Age applies to entire Midnight Peak Formation (see WAKc).
WATR;0,Phanerozoic,Mesozoic,Triassic,,,Phanerozoic Mesozoic  Triassic         ,Triassic,Phanerozoic,Paleozoic,Permian,,,Phanerozoic Paleozoic  Permian       ,Permian,199.6,299,Relative,"In Ferry County, Permian age rocks consist of greenstone and lenticular limestone, Triassic age rocks consist of well-bedded limestone, shlae, lesser amounts of greenstone (Parker and Calkins, 1964).  Martin Bridge Formation contains Norian (Late Triassic) age ammonites (Schuster and others, 1997)."
WATRJ;0,Phanerozoic,Mesozoic,Cretaceous,,,Phanerozoic Mesozoic  Cretaceous         ,Cretaceous,Phanerozoic,Mesozoic,Triassic,,,Phanerozoic Mesozoic  Triassic       ,Triassic,65.5,251,Relative,"Chert clasts in conglomerate yield Triassic radiolarians; pollen in conglomerate of Bald Mountain suggests Late Cretaceous to early Tertiary age (Dragovich and others, 2002).  "
WATs;0,Phanerozoic,Cenozoic,Tertiary,Oligocene,,Phanerozoic Cenozoic  Tertiary    Oligocene     ,Oligocene,Phanerozoic,Cenozoic,Tertiary,Paleocene,,Phanerozoic Cenozoic  Tertiary   Paleocene    ,Paleocene,23.03,65.5,Relative,"Foraminferal faunas indicate Nazarian to Zemorrian Stages (Eocene); megafossils indicate Paleocene to late Eocene; fission-track ages ranging from 25.6 to 44.6 Ma (Dragovich and others, 2002)."
WATv;0,Phanerozoic,Cenozoic,Tertiary,Oligocene,,Phanerozoic Cenozoic  Tertiary    Oligocene     ,Oligocene,Phanerozoic,Cenozoic,Tertiary,Eocene,,Phanerozoic Cenozoic  Tertiary   Eocene    ,Eocene,23.03,55.8,Relative,"Carter Mountain Dacite of Eocene age; Twin Peaks Andesite probably equivalent in age (Rinehart and Fox, 1976).  Zircon fission-track ages of 22-24 Ma in Eagle Tuff of King County (Tabor and others, 1993).  K-Ar hornblende and biotite ages range from 43 to 52 Ma"
WAuTv;0,Phanerozoic,Cenozoic,Tertiary,Miocene,,Phanerozoic Cenozoic  Tertiary    Miocene     ,Miocene,Phanerozoic,Cenozoic,Tertiary,Oligocene,,Phanerozoic Cenozoic  Tertiary   Oligocene    ,Oligocene,5.332,33.9,Relative,"Range based on Smith, 1993, and Dragovich and others, 2002."
WAwater;0,Phanerozoic,Cenozoic,Quaternary,Holocene,,Phanerozoic Cenozoic  Quaternary    Holocene     ,Holocene,Phanerozoic,Cenozoic,Quaternary,Holocene,,Phanerozoic Cenozoic  Quaternary   Holocene    ,Holocene,0,0.012,Relative,
